{
  "schema_version": 2,
  "id": "X1",
  "name": "My team",
  "defaults": {
    "researcher": "research-general",
    "implementer": "build-general",
    "reviewer": "review-general"
  },
  "agents": {
    "research-general": {
      "role": "researcher",
      "when": "Bounded repository and primary-source research.",
      "executor": {
        "harness": "codex",
        "model": "REPLACE_WITH_VERIFIED_MODEL_ID"
      }
    },
    "build-general": {
      "role": "implementer",
      "when": "Ordinary technical implementation with understood requirements.",
      "executor": {
        "harness": "codex",
        "model": "REPLACE_WITH_VERIFIED_MODEL_ID"
      }
    },
    "build-ui": {
      "role": "implementer",
      "when": "Components, layout, styling and visual behavior.",
      "executor": {
        "harness": "claude",
        "model": "REPLACE_WITH_VERIFIED_MODEL_ID"
      }
    },
    "review-general": {
      "role": "reviewer",
      "when": "Independent checking against the frozen specification and changes.",
      "executor": {
        "harness": "codex",
        "model": "REPLACE_WITH_VERIFIED_MODEL_ID"
      }
    }
  }
}
